{
  "$schema": "https://json-schema.org/draft/2020-12/schema",
  "$id": "https://github.com/venetisgr/card_image_info_extractor/shared/schema/card_info.schema.json",
  "title": "CardInfo",
  "description": "Canonical structured record for a sports card extracted by either engine (Claude API or on-device). Inputs are BOTH sides of the card (front + back). Single source of truth; Pydantic and Kotlin types are generated from this file. Extraction hint: year, brand, set and subset are most often printed at the bottom of the card front, and on the label if graded. NOTE: when card_type is 'graded', the 'graded' object should be present (may contain nulls if unreadable).",
  "type": "object",
  "additionalProperties": false,
  "required": ["card_type", "attributes", "per_field_confidence", "provenance"],
  "properties": {
    "card_type": {
      "description": "Whether the card is professionally graded/slabbed or raw (loose).",
      "type": "string",
      "enum": ["graded", "raw"]
    },
    "sport": {
      "description": "Sport the card belongs to (football = American football).",
      "anyOf": [
        { "type": "string", "enum": ["baseball", "basketball", "football", "hockey", "soccer", "other"] },
        { "type": "null" }
      ],
      "default": null
    },
    "player_name": {
      "description": "Subject/athlete name as printed.",
      "type": ["string", "null"],
      "default": null
    },
    "year": {
      "description": "Card year or season, e.g. '2003' or '2003-04'. Often printed at the bottom of the card and on the graded label.",
      "type": ["string", "null"],
      "default": null
    },
    "brand": {
      "description": "Card brand/maker (Topps, Panini, Upper Deck, Bowman, Fleer, ...), normalized. Often printed at the bottom of the card and on the graded label.",
      "type": ["string", "null"],
      "default": null
    },
    "set": {
      "description": "Product/set name, normalized. Often printed at the bottom of the card and on the graded label.",
      "type": ["string", "null"],
      "default": null
    },
    "subset": {
      "description": "Insert/subset name, if any. Often printed at the bottom of the card and on the graded label.",
      "type": ["string", "null"],
      "default": null
    },
    "parallel": {
      "description": "Parallel/variation, e.g. 'Silver Prizm'.",
      "type": ["string", "null"],
      "default": null
    },
    "card_number": {
      "description": "The card's number WITHIN the set, as printed (e.g. '#250', 'RC-12'). NOT the serial/print-run numbering like 5/30 — that goes in attributes.serial_number/serial_limit.",
      "type": ["string", "null"],
      "default": null
    },
    "team": {
      "description": "Player's team/franchise name, if present.",
      "type": ["string", "null"],
      "default": null
    },
    "language": {
      "description": "ISO language code if detectable.",
      "type": ["string", "null"],
      "default": null
    },
    "attributes": {
      "$ref": "#/$defs/Attributes"
    },
    "photo": {
      "description": "Visual details of the player's picture printed on the card.",
      "anyOf": [ { "$ref": "#/$defs/Photo" }, { "type": "null" } ],
      "default": null
    },
    "autograph": {
      "description": "Autograph/signature details.",
      "anyOf": [ { "$ref": "#/$defs/Autograph" }, { "type": "null" } ],
      "default": null
    },
    "memorabilia": {
      "description": "Embedded memorabilia details (patch/ball/floor/jersey/shoe pieces). There can be more than one piece in a card.",
      "anyOf": [ { "$ref": "#/$defs/Memorabilia" }, { "type": "null" } ],
      "default": null
    },
    "graded": {
      "description": "Grading details; present when card_type is 'graded'.",
      "anyOf": [
        { "$ref": "#/$defs/GradedInfo" },
        { "type": "null" }
      ],
      "default": null
    },
    "per_field_confidence": {
      "description": "Confidence in [0,1] for individual fields, keyed by field name (dot-paths allowed, e.g. 'autograph.ink_color').",
      "type": "object",
      "additionalProperties": { "type": "number", "minimum": 0, "maximum": 1 },
      "default": {}
    },
    "provenance": {
      "$ref": "#/$defs/Provenance"
    },
    "raw_output": {
      "description": "Raw engine output (OCR text or model JSON) for debugging.",
      "anyOf": [
        { "type": "object", "additionalProperties": true },
        { "type": "null" }
      ],
      "default": null
    }
  },
  "allOf": [
    {
      "if": {
        "properties": { "card_type": { "const": "graded" } },
        "required": ["card_type"]
      },
      "then": { "required": ["graded"] }
    }
  ],
  "$defs": {
    "Attributes": {
      "title": "Attributes",
      "description": "Card attribute flags and serial-numbering info.",
      "type": "object",
      "additionalProperties": false,
      "properties": {
        "rookie": { "description": "Rookie card (RC).", "type": "boolean", "default": false },
        "serial_number": { "description": "For a serial-numbered (limited) card such as '07/99', this copy's own number (the 07). Shows which copy this is out of the print run — NOT the card's number within the set.", "type": ["string", "null"], "default": null },
        "serial_limit": { "description": "For a serial-numbered (limited) card such as '07/99', the total print run / population (the 99).", "type": ["string", "null"], "default": null },
        "serial_matches_jersey_number": { "description": "True when the copy's serial number equals the player's jersey number (e.g. 07/99 for a player wearing #7) — such 'jersey-numbered' copies are rarer/more valuable. Null if unknown.", "type": ["boolean", "null"], "default": null }
      }
    },
    "Photo": {
      "title": "Photo",
      "description": "Visual details of the player's picture printed on the card.",
      "type": "object",
      "additionalProperties": false,
      "properties": {
        "jersey_colors": {
          "description": "Colors of the jersey the player is wearing in the card's picture, if visible (e.g. ['red','black','white']).",
          "anyOf": [ { "type": "array", "items": { "type": "string" } }, { "type": "null" } ],
          "default": null
        },
        "jersey_number": {
          "description": "Best guess for the number on the jersey in the card's picture, if visible (as printed, e.g. '23').",
          "type": ["string", "null"],
          "default": null
        },
        "jersey_number_candidates": {
          "description": "If the jersey number is uncertain (partially visible/occluded), all plausible candidates, best first (e.g. ['8','3']). Null/empty when jersey_number is confident or not visible.",
          "anyOf": [ { "type": "array", "items": { "type": "string" } }, { "type": "null" } ],
          "default": null
        }
      }
    },
    "Autograph": {
      "title": "Autograph",
      "description": "Autograph/signature details.",
      "type": "object",
      "additionalProperties": false,
      "properties": {
        "present": { "description": "Does the card contain an autograph? Null if unknown.", "type": ["boolean", "null"], "default": null },
        "ink_color": { "description": "Color of the signature ink (e.g. 'black', 'blue', 'gold', 'silver'). Black is the standard; any other color is rarer/more valuable.", "type": ["string", "null"], "default": null }
      }
    },
    "PieceType": {
      "title": "PieceType",
      "description": "Kind of embedded memorabilia piece.",
      "type": "string",
      "enum": ["patch", "jersey", "ball", "floor", "shoe", "other"]
    },
    "MemorabiliaPiece": {
      "title": "MemorabiliaPiece",
      "description": "One embedded memorabilia piece. A card can contain several.",
      "type": "object",
      "additionalProperties": false,
      "properties": {
        "type": {
          "description": "Kind of piece: patch (multi-color jersey patch), jersey (plain jersey swatch), ball, floor, shoe, or other.",
          "anyOf": [
            { "$ref": "#/$defs/PieceType" },
            { "type": "null" }
          ],
          "default": null
        },
        "is_fabric": { "description": "Is it an actual piece of fabric/material (true) vs a printed/manufactured facsimile (false)? Null if unclear.", "type": ["boolean", "null"], "default": null },
        "colors": {
          "description": "Distinct colors visible in the piece (e.g. ['wine','white','gold']).",
          "anyOf": [ { "type": "array", "items": { "type": "string" } }, { "type": "null" } ],
          "default": null
        },
        "unique_color_count": { "description": "Number of unique colors in the piece (more colors usually = rarer patch).", "type": ["integer", "null"], "minimum": 0, "default": null },
        "contains_team_logo_part": { "description": "Does the piece contain part of the team logo? Null if unclear.", "type": ["boolean", "null"], "default": null },
        "contains_player_name_part": { "description": "Does the piece contain part of the player's name (nameplate letters)? Null if unclear.", "type": ["boolean", "null"], "default": null },
        "contains_team_name_part": { "description": "Does the piece contain part of the team name lettering? Null if unclear.", "type": ["boolean", "null"], "default": null },
        "letters_visible": { "description": "Any letters/characters visible in the piece, as read (e.g. 'AME'). Null if none.", "type": ["string", "null"], "default": null }
      }
    },
    "Memorabilia": {
      "title": "Memorabilia",
      "description": "Embedded memorabilia in the card/slab. 'pieces' lists each embedded piece (can be more than one).",
      "type": "object",
      "additionalProperties": false,
      "properties": {
        "present": { "description": "Does the card contain memorabilia? Null if unknown.", "type": ["boolean", "null"], "default": null },
        "pieces": {
          "description": "Each embedded piece, analyzed individually.",
          "type": "array",
          "items": { "$ref": "#/$defs/MemorabiliaPiece" },
          "default": []
        }
      }
    },
    "Subgrades": {
      "title": "Subgrades",
      "description": "Per-aspect subgrades (e.g. BGS).",
      "type": "object",
      "additionalProperties": false,
      "properties": {
        "centering": { "type": ["number", "null"], "minimum": 0, "maximum": 10, "default": null },
        "corners": { "type": ["number", "null"], "minimum": 0, "maximum": 10, "default": null },
        "edges": { "type": ["number", "null"], "minimum": 0, "maximum": 10, "default": null },
        "surface": { "type": ["number", "null"], "minimum": 0, "maximum": 10, "default": null }
      }
    },
    "GradedInfo": {
      "title": "GradedInfo",
      "description": "Details read from a graded slab label and/or verified via a cert API.",
      "type": "object",
      "additionalProperties": false,
      "properties": {
        "grading_company": {
          "description": "Grading company. BGS = Beckett Grading Services.",
          "anyOf": [
            { "type": "string", "enum": ["PSA", "BGS", "SGC", "CGC", "TAG", "other"] },
            { "type": "null" }
          ],
          "default": null
        },
        "grade": { "description": "Numeric grade, e.g. 10 or 9.5.", "type": ["number", "null"], "minimum": 0, "maximum": 10, "default": null },
        "grade_label": { "description": "Grade label as printed, e.g. 'GEM-MT 10'.", "type": ["string", "null"], "default": null },
        "description": { "description": "The descriptive information line(s) from the graded label (year/brand/set/player/card# as the grader printed them).", "type": ["string", "null"], "default": null },
        "subgrades": {
          "anyOf": [ { "$ref": "#/$defs/Subgrades" }, { "type": "null" } ],
          "default": null
        },
        "autograph_grade": { "description": "Separate autograph grade printed on some labels (e.g. BGS 'AUTOGRAPH 10'), distinct from the card grade.", "type": ["number", "null"], "minimum": 0, "maximum": 10, "default": null },
        "cert_number": { "description": "Certification/serial number on the slab.", "type": ["string", "null"], "default": null },
        "label_text": { "description": "Full raw OCR of the label, for reference.", "type": ["string", "null"], "default": null }
      }
    },
    "Provenance": {
      "title": "Provenance",
      "description": "Where/how this record was produced.",
      "type": "object",
      "additionalProperties": false,
      "required": ["engine", "model_version", "timestamp"],
      "properties": {
        "engine": { "description": "Which engine produced this.", "type": "string", "enum": ["claude", "on_device"] },
        "model_version": { "description": "Model id (e.g. 'claude-opus-4-8') or app build.", "type": "string" },
        "timestamp": { "description": "ISO-8601 timestamp.", "type": "string", "format": "date-time" },
        "source_images": {
          "description": "References/hashes of the input image(s) — front and back.",
          "type": "array",
          "items": { "type": "string" },
          "default": []
        }
      }
    }
  }
}
