{
  "card_type": "graded",
  "sport": "basketball",
  "player_name": "LeBron James",
  "year": "2003-04",
  "brand": "Upper Deck",
  "set": "Exquisite Collection",
  "subset": "Rookie Patch Autograph",
  "parallel": null,
  "card_number": "78",
  "team": "Cleveland Cavaliers",
  "language": "en",
  "attributes": {
    "rookie": true,
    "serial_number": "23",
    "serial_limit": "99",
    "serial_matches_jersey_number": true
  },
  "photo": {
    "jersey_colors": ["wine", "gold", "white"],
    "jersey_number": "23",
    "jersey_number_candidates": null
  },
  "autograph": {
    "present": true,
    "ink_color": "blue"
  },
  "memorabilia": {
    "present": true,
    "pieces": [
      {
        "type": "patch",
        "is_fabric": true,
        "colors": ["wine", "white", "gold"],
        "unique_color_count": 3,
        "contains_team_logo_part": true,
        "contains_player_name_part": false,
        "contains_team_name_part": false,
        "letters_visible": null
      },
      {
        "type": "jersey",
        "is_fabric": true,
        "colors": ["white"],
        "unique_color_count": 1,
        "contains_team_logo_part": false,
        "contains_player_name_part": true,
        "contains_team_name_part": false,
        "letters_visible": "AME"
      }
    ]
  },
  "graded": {
    "grading_company": "BGS",
    "grade": 9.5,
    "grade_label": "GEM MINT 9.5",
    "description": "2003-04 EXQUISITE COLLECTION #78 LEBRON JAMES ROOKIE PATCH AUTOGRAPH 23/99",
    "subgrades": {
      "centering": 9.5,
      "corners": 9.5,
      "edges": 9.0,
      "surface": 9.5
    },
    "cert_number": "0012345678",
    "label_text": "2003-04 EXQUISITE COLLECTION LEBRON JAMES RPA #78 23/99 BGS GEM MINT 9.5 0012345678"
  },
  "per_field_confidence": {
    "player_name": 0.99,
    "graded.grade": 1.0,
    "graded.cert_number": 0.98,
    "attributes.serial_number": 0.95,
    "attributes.serial_limit": 0.95,
    "autograph.ink_color": 0.9,
    "memorabilia.pieces": 0.8
  },
  "provenance": {
    "engine": "claude",
    "model_version": "claude-opus-4-8",
    "timestamp": "2026-06-03T10:02:00Z",
    "source_images": ["sha256:front-ghi789", "sha256:back-ghi790"]
  },
  "raw_output": null
}
